{
    "motto": null,
    "research_interests": "AI and Law; Legal Natural Language Processing; Empirical Legal Studies; AI Governance; Constitutional Law",
    "bio": null,
    "education":[
        "University of California Berkeley School of Law (J.S.D.)",
        "Yale Law School (LL.M.)",
        "National Taiwan University College of Law (LL.B., LL.M.)"
    ],
    "fellowships_and_awards":[
        "Ministry of Technology TOP Grants",
        "UC Berkeley Dr. and Mrs. James C.Y. Soong Fellowship"
    ],
    "publication":[
        null,
        null,
        null
    ],
    "international_conference":[
        null,
        null,
        null
    ]
}